{
  "display_name": "PROJECT-LIBRARY",
  "format_version": "1",
  "grant_authorizer_id": "principal:human-admin",
  "id": "PROJECT-LIBRARY",
  "instance_id": "alm.synthetic.example",
  "kind": "scope",
  "owner_principal_id": "principal:library-owner",
  "parent_scope_id": "GLOBAL",
  "scope_type": "PROJECT"
}
